### ISSUE TITLE
 Local connection not found

### ISSUE THREAD

**Issue by slacker80** [SubstratumNetwork/SubstratumNode#8]
**SubstratumNode Version**
SubstratumNode-v0.4.2-Linux64-binary.zip

**Describe the bug**
When connecting to a freshly started bootstrap node the substratum network works for a while (with enough nodes to make it work). I can connect to websites and browse. `Curl` and `wget` work. But after a while, the network stops working. When I try to re-connect for instance. 

**To Reproduce**
1. Connect to bootstrap node: start standard node with `bootstrap_from` option with a node descriptor.
```
sudo ./SubstratumNode --dns_servers 1.1.1.1 --ip x.x.x.x --port_count 2 --log_level debug --bootstrap_from XXXXXxxxXXXXXXXX:x.x.x.x:40630,49797
```
2. See if your node is successfully connected `INFO: Neighborhood: Finished processing Gossip about 20 Nodes`
3. Try and `curl infor.cern.ch` 
4. In the /tmp/SubstratumNode.log is see: 
```
ERROR: Proxy Server: Failed to find route to <unknown>
INFO [<unnamed>] 2019-01-23 10:55:43.105 ThreadId(3): DEBUG: Dispatcher: Relaying 480 bytes to StreamHandlerPool for Socket(127.0.0.1:45120)
INFO [<unnamed>] 2019-01-23 10:55:43.105 ThreadId(3): DEBUG: Dispatcher: Handling order to transmit 480 bytes to Socket(127.0.0.1:45120)
INFO [<unnamed>] 2019-01-23 10:55:43.105 ThreadId(3): DEBUG: Dispatcher: Translating TransmitDataMsg to node query response about 127.0.0.1:45120
INFO [<unnamed>] 2019-01-23 10:55:43.105 ThreadId(3): DEBUG: Dispatcher: Handling node query response containing Some(NodeDescriptor { public_key: , node_addr_opt: Some(127.0.0.1:[45120]) })
INFO [<unnamed>] 2019-01-23 10:55:43.106 ThreadId(3): ERROR: Dispatcher: Local connection V4(127.0.0.1:45120) not found. Discarding 480 bytes.
```
5. Looks like something goes wrong with connection to 127.0.0.1, :
```
# ss -nltpua | grep 45120
tcp  TIME-WAIT 0       0                 127.0.0.1:45120        127.0.0.1:80
```

tcpdump on loopback device when running `curl` command
```
# tcpdump -v -n -i lo 
11:55:27.574317 IP (tos 0x0, ttl 64, id 53424, offset 0, flags [DF], proto UDP (17), length 55)
    127.0.0.1.47319 > 127.0.0.1.53: 62512+ A? google.nl. (27)
11:55:27.576841 IP (tos 0x0, ttl 64, id 53425, offset 0, flags [DF], proto UDP (17), length 80)
    127.0.0.1.53 > 127.0.0.1.47319: 62512 1/0/0 google.nl. A 127.0.0.1 (52)
11:55:27.577147 IP (tos 0x0, ttl 64, id 53426, offset 0, flags [DF], proto UDP (17), length 55)
    127.0.0.1.47319 > 127.0.0.1.53: 62464+ AAAA? google.nl. (27)
11:55:27.577357 IP (tos 0x0, ttl 64, id 53427, offset 0, flags [DF], proto UDP (17), length 40)
    127.0.0.1.53 > 127.0.0.1.47319: 62464 NotImp [0q] 0/0/0 (12)
11:55:32.577008 IP (tos 0x0, ttl 64, id 53662, offset 0, flags [DF], proto UDP (17), length 55)
    127.0.0.1.47319 > 127.0.0.1.53: 62512+ A? google.nl. (27)
11:55:32.577365 IP (tos 0x0, ttl 64, id 53663, offset 0, flags [DF], proto UDP (17), length 80)
    127.0.0.1.53 > 127.0.0.1.47319: 62512 1/0/0 google.nl. A 127.0.0.1 (52)
11:55:32.577677 IP (tos 0x0, ttl 64, id 53664, offset 0, flags [DF], proto UDP (17), length 55)
    127.0.0.1.47319 > 127.0.0.1.53: 62464+ AAAA? google.nl. (27)
11:55:32.579220 IP (tos 0x0, ttl 64, id 53665, offset 0, flags [DF], proto UDP (17), length 40)
    127.0.0.1.53 > 127.0.0.1.47319: 62464 NotImp [0q] 0/0/0 (12)
11:55:37.581883 IP (tos 0x0, ttl 64, id 54521, offset 0, flags [DF], proto UDP (17), length 55)
    127.0.0.1.38014 > 127.0.0.1.53: 62512+ A? google.nl. (27)
11:55:37.583687 IP (tos 0x0, ttl 64, id 54522, offset 0, flags [DF], proto UDP (17), length 80)
    127.0.0.1.53 > 127.0.0.1.38014: 62512 1/0/0 google.nl. A 127.0.0.1 (52)
11:55:37.583951 IP (tos 0x0, ttl 64, id 54523, offset 0, flags [DF], proto UDP (17), length 55)
    127.0.0.1.60509 > 127.0.0.1.53: 62464+ AAAA? google.nl. (27)
11:55:37.584167 IP (tos 0x0, ttl 64, id 54524, offset 0, flags [DF], proto UDP (17), length 40)
    127.0.0.1.53 > 127.0.0.1.60509: 62464 NotImp [0q] 0/0/0 (12)
11:55:43.097549 IP (tos 0x0, ttl 64, id 17641, offset 0, flags [DF], proto TCP (6), length 60)
    127.0.0.1.45120 > 127.0.0.1.80: Flags [S], cksum 0xfe30 (incorrect -> 0xb93d), seq 3532994811, win 43690, options [mss 65495,sackOK,TS val 666896401 ecr 0,nop,wscale 6], length 0
11:55:43.097601 IP (tos 0x0, ttl 64, id 0, offset 0, flags [DF], proto TCP (6), length 60)
    127.0.0.1.80 > 127.0.0.1.45120: Flags [S.], cksum 0xfe30 (incorrect -> 0xd654), seq 1377919205, ack 3532994812, win 43690, options [mss 65495,sackOK,TS val 666896401 ecr 666896401,nop,wscale 6], length 0
11:55:43.097630 IP (tos 0x0, ttl 64, id 17642, offset 0, flags [DF], proto TCP (6), length 52)
    127.0.0.1.45120 > 127.0.0.1.80: Flags [.], cksum 0xfe28 (incorrect -> 0xa743), ack 1, win 683, options [nop,nop,TS val 666896401 ecr 666896401], length 0
11:55:43.100827 IP (tos 0x0, ttl 64, id 7413, offset 0, flags [DF], proto TCP (6), length 532)
    127.0.0.1.80 > 127.0.0.1.45120: Flags [P.], cksum 0x0009 (incorrect -> 0x09fb), seq 1:481, ack 74, win 683, options [nop,nop,TS val 666896404 ecr 666896401], length 480: HTTP, length: 480
        HTTP/1.1 503 Routing Error
        Content-Type: text/html
        Content-Length: 404

        <html>
        <body>
        <h1>Error 503</h1>
        <h2>Title: Routing Problem</h2>
        <h3>Subtitle: Can't find a route to google.nl</h3>
        <p>Substratum can't find a route through the Network yet to a Node that knows where to find google.nl. Maybe later enough will be known about the Network to find that Node, but we can't guarantee it. We're sorry.</p>
        <p>This will look much better after SC-378 is done</p>
        </body>
        </html>
11:55:43.100834 IP (tos 0x0, ttl 64, id 17644, offset 0, flags [DF], proto TCP (6), length 52)
    127.0.0.1.45120 > 127.0.0.1.80: Flags [.], cksum 0xfe28 (incorrect -> 0xa503), ack 481, win 700, options [nop,nop,TS val 666896404 ecr 666896404], length 0
11:55:43.101373 IP (tos 0x0, ttl 64, id 17645, offset 0, flags [DF], proto TCP (6), length 52)
    127.0.0.1.45120 > 127.0.0.1.80: Flags [F.], cksum 0xfe28 (incorrect -> 0xa501), seq 74, ack 481, win 700, options [nop,nop,TS val 666896405 ecr 666896404], length 0
11:55:43.105204 IP (tos 0x0, ttl 64, id 7414, offset 0, flags [DF], proto TCP (6), length 52)
    127.0.0.1.80 > 127.0.0.1.45120: Flags [F.], cksum 0xfe28 (incorrect -> 0xa50c), seq 481, ack 75, win 683, options [nop,nop,TS val 666896409 ecr 666896405], length 0
11:55:43.105213 IP (tos 0x0, ttl 64, id 17646, offset 0, flags [DF], proto TCP (6), length 52)
    127.0.0.1.45120 > 127.0.0.1.80: Flags [.], cksum 0xfe28 (incorrect -> 0xa4f7), ack 482, win 700, options [nop,nop,TS val 666896409 ecr 666896409], length 0
```

**Expected behavior**
When running `curl info.cern.ch` I expect to see the html source of the website of course .

**Screenshots**
See above 

**Log files**
Include any relavent logging information. (e.g. /tmp/SubstratumNode.log on Ubuntu)
[SubstratumNode.log](https://github.com/SubstratumNetwork/SubstratumNode/files/2786967/SubstratumNode.log)

**Device Details (please complete the following information):**
 - Device Type: VPS (kvm virtual machine)
 - OS name and version: Ubuntu 18.04.1 LTS
 - Application: curl, wget, firefox

**Additional context**
I want to help to test and see substratum succeed.

**Comment by SUB-BJ** [comment]
Thank you for this. We will gladly take a look in more detail. You did a fine job documenting it and we appreciate the log file. 

At first glance it does show that the node you were trying to work with didn't have connectivity yet with other Nodes or also appears to have possibly lost connectivity with them because it shows distant nodes with IP addresses. I was able to look at the neighborhood visualizations produced by each place in the logs that prints out a  graph db { .. } tag. You had about 20 Nodes and the Node you were printing the neighborhood logs from for some reason knew the IP address of a couple distant nodes which tells me that it could have been once connected and lost that connection for some reason. It's quite possible that no further action produced from the Nodes to produce new gossip in order to "self heal" connectivity with other Nodes could have been the case here. So, simply adding or removing an additional Node to the neighborhood may have resolved it because that would trigger gossip.

Just a heads up our edge code on Github (that you have to compile yourself) has replaced the --bootstrap_from usage with --neighbor parameter specified in top-level [README.md](https://github.com/SubstratumNetwork/SubstratumNode/blob/master/README.md) file. The latest functionality in the 0.4.2 release also made it possible to be bootstrapped from any Node to start producing neighborhood gossip exchanges.

There are definitely further improvements to be made to gossip, routing, self healing, and stability to come as well. We hope to keep you posted with further information.

**Comment by SUB-BJ** [comment]
We are prioritizing work to ensure that neighborhoods are not becoming overly connected with too many edge nodes or "Immediate Neighbors." We believe this could be some of the problem outside of some other things you may have going on. The reason why it's important to have "remote nodes" or nodes that we don't know the IP addresses of is because those will be chosen for exit node services. Therefore, if you know the IP addresses of all nodes it will not be able to form a route.

**Comment by slacker80** [comment]
Thank you for clarifying! Just need more distant nodes in the network. But do I understand right that a bootstrap node cannot ever be used for creating routes and thus browse the internet? Because a bootstrap node knows all the ip addresses?  

If one of the devs wants to chat please let me know, I will be more than happy to explain how I've set up my nodes.  In the meantime, I will see if I can get a network of sub nodes running with help of other community members. And will create an issue for my compiling issues.

**Comment by SUB-BJ** [comment]
Bootstrap only nodes help bootstrap neighbors and don't perform routing. However, regular neighbors can now bootstrap as well now. So, there's a limited use case for such nodes.

Thanks for your help!

**Comment by SUB-BJ** [comment]
This has been overtaken with events and shouldn't be an issue anymore. There is still a possibility that a route can't be built based on the number of participating nodes in a neighborhood. However, that's by design.
